<?xml version="1.0"?>
<!--
/**
 * Magento
 *
 * NOTICE OF LICENSE
 *
 * This source file is subject to the Academic Free License (AFL 3.0)
 * that is bundled with this package in the file LICENSE_AFL.txt.
 * It is also available through the world-wide-web at this URL:
 * http://opensource.org/licenses/afl-3.0.php
 * If you did not receive a copy of the license and are unable to
 * obtain it through the world-wide-web, please send an email
 * to license@magentocommerce.com so we can send you a copy immediately.
 *
 * DISCLAIMER
 *
 * Do not edit or add to this file if you wish to upgrade Magento to newer
 * versions in the future. If you wish to customize Magento for your
 * needs please refer to http://www.magentocommerce.com for more information.
 *
 * @copyright   Copyright (c) 2014 X.commerce, Inc. (http://www.magentocommerce.com)
 * @license     http://opensource.org/licenses/afl-3.0.php  Academic Free License (AFL 3.0)
 */
-->
<config xmlns:xsi="http://www.w3.org/2001/XMLSchema-instance" xsi:noNamespaceSchemaLocation="../../../../../lib/internal/Magento/Framework/Acl/etc/acl.xsd">
    <acl>
        <resources>
            <resource id="Magento_Adminhtml::admin">
                <resource id="Magento_Adminhtml::marketing">
                    <resource id="Magento_Adminhtml::marketing_communications">
                        <resource id="Magento_Newsletter::template" title="Newsletter Template" sortOrder="20" />
                        <resource id="Magento_Newsletter::queue" title="Newsletter Queue" sortOrder="30"/>
                        <resource id="Magento_Newsletter::subscriber" title="Newsletter Subscribers" sortOrder="40"/>
                    </resource>
                </resource>
                <resource id="Magento_Reports::report">
                    <resource id="Magento_Reports::report_marketing">
                        <resource id="Magento_Newsletter::problem" title="Newsletter Problem Reports" sortOrder="40"/>
                    </resource>
                </resource>
                <resource id="Magento_Adminhtml::stores">
                    <resource id="Magento_Adminhtml::stores_settings">
                        <resource id="Magento_Adminhtml::config">
                            <resource id="Magento_Newsletter::newsletter" title="Newsletter Section" />
                        </resource>
                    </resource>
                </resource>
            </resource>
        </resources>
    </acl>
</config>
