<?xml version="1.0"?>
<!--
/**
 * Magento
 *
 * NOTICE OF LICENSE
 *
 * This source file is subject to the Academic Free License (AFL 3.0)
 * that is bundled with this package in the file LICENSE_AFL.txt.
 * It is also available through the world-wide-web at this URL:
 * http://opensource.org/licenses/afl-3.0.php
 * If you did not receive a copy of the license and are unable to
 * obtain it through the world-wide-web, please send an email
 * to license@magentocommerce.com so we can send you a copy immediately.
 *
 * DISCLAIMER
 *
 * Do not edit or add to this file if you wish to upgrade Magento to newer
 * versions in the future. If you wish to customize Magento for your
 * needs please refer to http://www.magentocommerce.com for more information.
 *
 * @copyright   Copyright (c) 2014 X.commerce, Inc. (http://www.magentocommerce.com)
 * @license     http://opensource.org/licenses/afl-3.0.php  Academic Free License (AFL 3.0)
 */
-->
<config xmlns:xsi="http://www.w3.org/2001/XMLSchema-instance" xsi:noNamespaceSchemaLocation="../../../../../../../../../../lib/internal/Magento/Framework/Acl/etc/acl.xsd">
    <acl>
        <resources>
            <!-- commented text -->
            <resource id="Custom_Module::resource_one" title="Resource One Title" sortOrder="10" disabled="true" />
            <resource id="Custom_Module::resource_two" title="Resource Two Title" sortOrder="20" />
            <resource id="Custom_Module::parent_resource" title="Parent Resource Title" sortOrder="50">
                <!-- commented text -->
                <resource id="Custom_Module::child_resource_one" title="Resource Child Title" sortOrder="30">
                    <!-- commented text -->
                    <resource id="Custom_Module::child_resource_two" title="Resource Child Level 2 Title" sortOrder="10" />
                </resource>
            </resource>
        </resources>
    </acl>
</config>
